{
  "documentSummary":{"title":"DailyDraw","featureSummary":"OneFreeDrawDaily","actors":["PLAYER"]},
  "categoryTree":[{"majorCategory":"Draw","middleCategories":[{"name":"Reward","minorCategories":["DailyCount"]}]}],
  "requirements":[{"requirementId":"REQ-001","majorCategory":"Draw","middleCategory":"Reward","minorCategory":"DailyCount","title":"DailyDraw","description":"OneDrawDaily","actor":"PLAYER","preconditions":["LoggedIn"],"trigger":"SelectButton","expectedBehaviors":["RewardGranted"],"evidences":[{"evidenceType":"EXPLICIT","pageNumber":3,"sectionTitle":"Policy","sourceText":"OneDrawDaily","sourceElementType":"TEXT","reason":"CountSpecified"}]}],
  "testCases":[{"testCaseId":"TC-001","requirementId":"REQ-001","displayOrder":1,"majorCategory":"Draw","middleCategory":"Reward","minorCategory":"DailyCount","testItem":"UseFreeDraw","testType":"HAPPY_PATH","priority":"HIGH","preconditions":["LoggedIn"],"testSteps":[{"stepNumber":1,"action":"SelectButton","expectedResult":"ResultShown"}],"expectedResults":["RewardGranted"],"confidence":"HIGH","requiresHumanReview":false,"evidences":[{"evidenceType":"EXPLICIT","verificationStatus":"EXACT","pageNumber":3,"sectionTitle":"Policy","sourceElementId":"PAGE-3-TEXT-01","sourceText":"OneDrawDaily","sourceElementType":"TEXT","boundingBox":{"x":0.1,"y":0.2,"width":0.5,"height":0.1},"reason":"CountSpecified"}],"notes":[]}],
  "ambiguities":[{"ambiguityId":"AMB-001","relatedRequirementIds":["REQ-001"],"majorCategory":"Draw","middleCategory":"Reset","minorCategory":"ResetTime","title":"ResetTimeUnknown","description":"NoResetTime","question":"ServerTime","impact":"BoundaryUnknown","severity":"HIGH","evidences":[{"evidenceType":"INFERRED","pageNumber":3,"sectionTitle":"Policy","sourceText":"ResetDaily","sourceElementType":"TEXT","reason":"TimeMissing"}]}],
  "qualityWarnings":[]
}
